{
  "id": "MB-246",
  "exam": "MRCS-B",
  "title": "Cervical spinal cord injury and neurogenic shock",
  "type": "applied-knowledge",
  "header": {
    "domain": "Applied Knowledge",
    "contentArea": "Trauma: spinal cord injury (clinical scenario with examiner-supplied findings)",
    "minutes": 9,
    "readingMinutes": 1,
    "guidelineVersions": [
      "NICE NG41 Spinal injury: assessment and initial management (February 2016)",
      "BOASt: The Management of Traumatic Spinal Cord Injury (November 2022)",
      "BOASt: Assessment of the Spine in the Trauma Patient (April 2025)",
      "AO Spine/Praxis haemodynamic guideline (Kwon et al., Global Spine J 2024)",
      "Resuscitation Council UK Adult ALS guidelines (October 2025)"
    ]
  },
  "brief": {
    "setting": "Emergency department, major trauma centre",
    "role": "Core surgical trainee on the trauma team",
    "scenario": "Mr Lewis Drummond, 34, came off his motorcycle at speed. He arrives with a collar, head blocks and scoop stretcher. He is alert. BP 85/50 mmHg, heart rate 52, warm dry feet. He cannot move his legs.",
    "task": "Answer the examiner's questions on his assessment and management."
  },
  "beforeYouWalkIn": {
    "frame": "Protect the spine, find the bleeding first, then call it neurogenic shock and treat it.",
    "trap": "Blaming the hypotension on the cord before looking for haemorrhage.",
    "firstMove": "\"Catastrophic haemorrhage, then airway with manual in-line stabilisation.\""
  },
  "flow": [
    "Primary survey with spinal protection",
    "Is he bleeding?",
    "Neurogenic or spinal shock",
    "Blood pressure and heart rate",
    "Imaging and neurology",
    "Specialist care"
  ],
  "grid": [
    {
      "id": "G1",
      "domain": "clinical-skill",
      "label": "Primary survey with spinal protection",
      "fail": "Removes the collar to examine the neck, or ignores breathing.",
      "pass": "<C>ABCDE with manual in-line stabilisation during any airway intervention; log roll; watches for respiratory failure.",
      "high": "Explains the diaphragm is C3 to C5, so a cervical cord injury can progress to ventilatory failure: early anaesthetic and critical care input.",
      "source": "GRAYS"
    },
    {
      "id": "G2",
      "domain": "professionalism",
      "label": "Excludes haemorrhage",
      "fail": "Attributes the hypotension to the cord injury without looking for bleeding.",
      "pass": "Treats hypotension as haemorrhage until excluded: chest, abdomen, pelvis, long bones, external; FAST and trauma CT.",
      "high": "Notes that cord injury can mask abdominal pain and tachycardia, so bleeding may be clinically silent.",
      "source": "BL"
    },
    {
      "id": "G3",
      "domain": "clinical-knowledge",
      "label": "Recognises neurogenic shock",
      "fail": "Cannot explain why he is bradycardic and warm.",
      "pass": "Neurogenic shock: loss of sympathetic outflow below a lesion above T6, giving vasodilatation, hypotension and bradycardia with warm peripheries.",
      "high": "Sympathetic outflow is T1 to L2 and cardiac accelerator fibres T1 to T4, so vagal tone is unopposed.",
      "source": "FICM"
    },
    {
      "id": "G4",
      "domain": "clinical-knowledge",
      "label": "Separates spinal shock",
      "fail": "Uses spinal shock and neurogenic shock interchangeably.",
      "pass": "Spinal shock is neurological: temporary flaccid paralysis, areflexia and sensory loss below the lesion, lasting hours to weeks.",
      "high": "Completeness cannot be judged until spinal shock resolves; return of the bulbocavernosus reflex is classically used as its end.",
      "source": "FICM"
    },
    {
      "id": "G5",
      "domain": "clinical-knowledge",
      "label": "Blood pressure and heart rate",
      "fail": "Gives repeated large fluid boluses, or ignores the bradycardia.",
      "pass": "Cautious fluid, then a vasopressor with an arterial line in critical care; treats bradycardia with adverse signs.",
      "high": "Targets MAP at least 75 to 80 mmHg, not pushed beyond 90 to 95, for 3 to 7 days.",
      "source": "KWON"
    },
    {
      "id": "G6",
      "domain": "clinical-skill",
      "label": "Imaging and neurology",
      "fail": "Relies on plain films, or stops at a normal CT despite a deficit.",
      "pass": "CT first; MRI after CT for any deficit that could be cord injury, even if CT is normal. ISNCSCI chart within 2 hours.",
      "high": "Requests whole-spine MRI once safe, and states the neurological level from the chart: C5 here.",
      "source": "BOASTSCI"
    },
    {
      "id": "G7",
      "domain": "professionalism",
      "label": "Specialist care",
      "fail": "Gives methylprednisolone, or does not contact the spinal team.",
      "pass": "Immediate spinal surgeon referral; linked spinal cord injury centre. No methylprednisolone, nimodipine or naloxone for neuroprotection.",
      "high": "Early decompression within 24 hours where feasible; catheter, pressure care and nasogastric tube for ileus.",
      "source": "FEHLINGS"
    }
  ],
  "performances": {
    "fail": [
      {
        "speaker": "examiner",
        "text": "How would you start?"
      },
      {
        "speaker": "candidate",
        "text": "I'd take the collar off to examine his neck properly.",
        "tags": [
          {
            "row": "G1",
            "band": "fail"
          }
        ]
      },
      {
        "speaker": "examiner",
        "text": "His BP is 85/50. Why?"
      },
      {
        "speaker": "candidate",
        "text": "It's the spinal injury. That explains it.",
        "tags": [
          {
            "row": "G2",
            "band": "fail"
          }
        ]
      },
      {
        "speaker": "examiner",
        "text": "Why is his heart rate 52?"
      },
      {
        "speaker": "candidate",
        "text": "I'm not sure. Maybe he's fit.",
        "tags": [
          {
            "row": "G3",
            "band": "fail"
          }
        ]
      },
      {
        "speaker": "examiner",
        "text": "What is spinal shock?"
      },
      {
        "speaker": "candidate",
        "text": "The same as neurogenic shock: low blood pressure after a spinal injury.",
        "tags": [
          {
            "row": "G4",
            "band": "fail"
          }
        ]
      },
      {
        "speaker": "examiner",
        "text": "How would you treat the blood pressure?"
      },
      {
        "speaker": "candidate",
        "text": "Two litres of fluid, then more if needed.",
        "tags": [
          {
            "row": "G5",
            "band": "fail"
          }
        ]
      },
      {
        "speaker": "examiner",
        "text": "Imaging?"
      },
      {
        "speaker": "candidate",
        "text": "Neck X-rays.",
        "tags": [
          {
            "row": "G6",
            "band": "fail"
          }
        ]
      },
      {
        "speaker": "examiner",
        "text": "Any drugs for the cord?"
      },
      {
        "speaker": "candidate",
        "text": "High-dose methylprednisolone.",
        "tags": [
          {
            "row": "G7",
            "band": "fail"
          }
        ]
      }
    ],
    "pass": [
      {
        "speaker": "examiner",
        "text": "How would you start?"
      },
      {
        "speaker": "candidate",
        "text": "<C>ABCDE, keeping manual in-line stabilisation during any airway intervention, and log rolling. I'd watch his breathing closely.",
        "tags": [
          {
            "row": "G1",
            "band": "pass"
          }
        ]
      },
      {
        "speaker": "examiner",
        "text": "His BP is 85/50. Why?"
      },
      {
        "speaker": "candidate",
        "text": "Haemorrhage until proven otherwise. I'd look in the chest, abdomen, pelvis, long bones and externally, with a FAST scan and trauma CT.",
        "tags": [
          {
            "row": "G2",
            "band": "pass"
          }
        ]
      },
      {
        "speaker": "examiner",
        "text": "No bleeding is found. Heart rate 52, feet warm."
      },
      {
        "speaker": "candidate",
        "text": "That's neurogenic shock. A lesion above T6 cuts sympathetic outflow, so he vasodilates and becomes bradycardic.",
        "tags": [
          {
            "row": "G3",
            "band": "pass"
          }
        ]
      },
      {
        "speaker": "examiner",
        "text": "How is spinal shock different?"
      },
      {
        "speaker": "candidate",
        "text": "Spinal shock is neurological: temporary flaccid paralysis, areflexia and sensory loss below the lesion, lasting hours to weeks.",
        "tags": [
          {
            "row": "G4",
            "band": "pass"
          }
        ]
      },
      {
        "speaker": "examiner",
        "text": "How would you manage his circulation?"
      },
      {
        "speaker": "candidate",
        "text": "Cautious fluid, then a vasopressor with an arterial line in critical care. If bradycardia has adverse signs, atropine 500 micrograms, repeated up to 3 mg.",
        "tags": [
          {
            "row": "G5",
            "band": "pass"
          }
        ]
      },
      {
        "speaker": "examiner",
        "text": "What imaging?"
      },
      {
        "speaker": "candidate",
        "text": "CT first, then MRI because he has a deficit, even if CT is normal. And a full ISNCSCI chart within 2 hours.",
        "tags": [
          {
            "row": "G6",
            "band": "pass"
          }
        ]
      },
      {
        "speaker": "examiner",
        "text": "Who else needs to know?"
      },
      {
        "speaker": "candidate",
        "text": "The spinal surgeon on call now, and the linked spinal cord injury centre. No steroids, nimodipine or naloxone.",
        "tags": [
          {
            "row": "G7",
            "band": "pass"
          }
        ]
      }
    ],